<scene xmlns:xsi="http://www.w3.org/2001/XMLSchema-instance"
       xsi:noNamespaceSchemaLocation="../scene.xsd">

    <entity name="monkey_center">
        <transform>
            <translate value="0, 0, 0"/>
        </transform>
        <mesh path="models/suzanne.obj"/>
        <material albedo="1.0, 1.0, 1.0" roughness="0.1" metallic="1.0"/>
    </entity>

    <entity name="monkey_left">
        <transform>
            <translate value="-3, 0, 0"/>
            <rotate axis="0, 1, 0" angle="45"/>
        </transform>
        <mesh path="models/suzanne.obj"/>
        <material albedo="0.8, 0.8, 0.8" roughness="0.3" metallic="1.0"/>
    </entity>

    <entity name="monkey_right">
        <transform>
            <translate value="3, 0, 0"/>
            <rotate axis="0, 1, 0" angle="-45"/>
        </transform>
        <mesh path="models/suzanne.obj"/>
        <material albedo="0.2, 0.2, 0.2" roughness="0.05" metallic="0.0"/>
    </entity>

    <entity name="main_camera">
        <transform>
            <lookat origin="0, 2, 8" target="0, 0, 0" up="0, 1, 0"/>
        </transform>
        <camera/>
    </entity>

    <entity name="sun_light">
        <transform>
            <lookat origin="0, 0, 0" target="-1, -1, -1" up="0, 1, 0"/>
        </transform>
        <directional_light color="1.0, 0.9, 0.8" intensity="1.5"/>
    </entity>

    <entity name="red_point_light">
        <transform>
            <translate value="-3, 1, 2"/>
        </transform>
        <point_light color="1.0, 0.1, 0.1" intensity="50.0" attenuation="1.0" radius="10.0"/>
    </entity>

    <entity name="blue_point_light">
        <transform>
            <translate value="3, -1, 2"/>
        </transform>
        <point_light color="0.1, 0.1, 1.0" intensity="50.0" attenuation="1.0" radius="10.0"/>
    </entity>

    <entity name="green_point_light">
        <transform>
            <translate value="0, 3, -2"/>
        </transform>
        <point_light color="0.1, 1.0, 0.1" intensity="30.0" attenuation="1.0" radius="15.0"/>
    </entity>
</scene>